"Status","Start Time","Stop Time","Duration in ms","Parent Suite","Suite","Sub Suite","Test Class","Test Method","Name","Description"
"passed","Fri Jan 10 18:05:20 IST 2025","Fri Jan 10 18:06:16 IST 2025","55643","","Product Description Page Scenarios for makerplace","","","","Verify Share links upon hovering share icon",""
"passed","Fri Jan 10 17:37:21 IST 2025","Fri Jan 10 17:39:08 IST 2025","107052","","Cart page Scenarios","","","","[Sign-in User] Verify items in the cart and store Name persist when the guest user signin, signout and re signin",""
"passed","Fri Jan 10 17:05:38 IST 2025","Fri Jan 10 17:06:19 IST 2025","41208","","E2E - EventHub portal Scenarios","","","","Create template for Online Event",""
"broken","Fri Jan 10 16:31:02 IST 2025","Fri Jan 10 16:32:43 IST 2025","101522","","E2E - Checkout Scenarios -SDD","","","","[Guest User]PlaceOrder using Same Day Delivery",""
"passed","Fri Jan 10 17:35:15 IST 2025","Fri Jan 10 17:36:02 IST 2025","47769","","Mega menu Scenarios","","","","Verify submenu navigation, disappearance, parent menu highlight, and options validation",""
"passed","Fri Jan 10 17:06:58 IST 2025","Fri Jan 10 17:07:44 IST 2025","46634","","E2E - EventHub portal Scenarios","","","","Create template for Online Class",""
