"Status","Start Time","Stop Time","Duration in ms","Parent Suite","Suite","Sub Suite","Test Class","Test Method","Name","Description"
"passed","Mon Feb 17 17:11:14 IST 2025","Mon Feb 17 17:11:32 IST 2025","17898","","Global Scenarios - Headers & Footer","","","","Verify the user is able to click on the ""Back to Top"" up arrow button from home page",""
"passed","Mon Feb 17 17:05:16 IST 2025","Mon Feb 17 17:06:36 IST 2025","79826","","Global Scenarios - Header & Footer for Makerplace","","","","Validate content for global headers and footers in makerplace_home page for makerplace",""
"passed","Mon Feb 17 16:01:21 IST 2025","Mon Feb 17 16:03:39 IST 2025","138084","","E2E - Checkout Mixcart Scenarios","","","","[Guest user][.com]Place order using shipping methods - STM, SDD",""
"passed","Mon Feb 17 16:16:07 IST 2025","Mon Feb 17 16:17:44 IST 2025","96297","","E2E - Classes, Events & Project Scenarios","","","","[Guest User][Classes & Events][.COM]Free Classes & Events at online",""
"passed","Mon Feb 17 17:11:32 IST 2025","Mon Feb 17 17:11:53 IST 2025","21053","","Global Scenarios - Headers & Footer","","","","Verify the user is able to click on the ""Back to Top"" up arrow button from clp page",""
